{"candidate_content_hash":"sha256:5138ebb5f41ccaaa8150d7dfb37b17de84a91524bd53aa38b01309bae881a41e","candidate_id":"candidate:v1:453721efc1e375480a9c77c56435cd38ccdc902236084da1d53dffe470f6e44f","content_hash":"sha256:36c34820da7872520e47898c2bac95ed269dc64e6201dffe12f43184433a3191","contract_type":"factory_decision","created_at":"2026-07-27T03:00:00Z","decision_id":"decision:v1:d109b8e8b73069895ed9054f8ee354131e9989df43ac31bdfd9e6102552e222e","decision_source":"automation","disposition":"deferred","findings":[{"code":"change.large_diff_requires_review","expected":{"maximum_changed_lines":200,"maximum_files":3},"message":"The change exceeds normal automatic screening thresholds.","observed":{"changed_lines":58,"files":5},"rule_id":"v07-normal-diff-size","severity":"defer"},{"code":"review.root_cause_required","expected":{"reviewed":true},"message":"Root-cause classification requires human review.","observed":false,"rule_id":"v07-root-cause-review","severity":"warning"}],"prior_decision":null,"rule_set_hash":"sha256:074da20727e519d357273a7ea6d862e024a9c186bfdac5b408b7a6c57621d262","rule_set_id":"screening:v1:074da20727e519d357273a7ea6d862e024a9c186bfdac5b408b7a6c57621d262","schema_version":"v1","target_dimension":"boundary","target_subclass":"B5"}