{"candidate_content_hash":"sha256:23d65e20e10f6d4b9c6e2ef65fa4ab44e6efee8e9eb160c5ff9c9dcb32868936","candidate_id":"candidate:v1:ba1765f4dcd4fa157ff3ed9fadbec9f21aeced8922794fb31a9965f11210c65a","content_hash":"sha256:3682bccf98acc187308bb108bb0e663b668960ed8104307418c7a7e916baa4ee","contract_type":"factory_decision","created_at":"2026-07-27T03:00:00Z","decision_id":"decision:v1:83bd88540a51dfaf7c817a96d9158c8b0f4c99b4109626a95898daa773e3e8c3","decision_source":"automation","disposition":"accepted","findings":[{"code":"review.root_cause_required","expected":{"reviewed":true},"message":"Root-cause classification requires human review.","observed":false,"rule_id":"v07-root-cause-review","severity":"warning"}],"prior_decision":null,"rule_set_hash":"sha256:074da20727e519d357273a7ea6d862e024a9c186bfdac5b408b7a6c57621d262","rule_set_id":"screening:v1:074da20727e519d357273a7ea6d862e024a9c186bfdac5b408b7a6c57621d262","schema_version":"v1","target_dimension":"boundary","target_subclass":"B2"}