{"candidate_content_hash":"sha256:51d7072639332f255679eb1bd77188776789a6f73b8867e7a4384f689ff57368","candidate_id":"candidate:v1:f301894ce2282667f4d874286013abd75a73e7f0e50e3270ba08b671de600d5b","content_hash":"sha256:f6779ddd567e0066ce1a742aad73b267b8e4f74a3316317f445a46833de94c57","contract_type":"factory_decision","created_at":"2026-07-27T03:00:00Z","decision_id":"decision:v1:29c140ecd1994611042d916cec3847e9816ca285c16370ad25a009fcba004aa5","decision_source":"automation","disposition":"accepted","findings":[{"code":"review.root_cause_required","expected":{"reviewed":true},"message":"Root-cause classification requires human review.","observed":false,"rule_id":"v07-root-cause-review","severity":"warning"}],"prior_decision":null,"rule_set_hash":"sha256:074da20727e519d357273a7ea6d862e024a9c186bfdac5b408b7a6c57621d262","rule_set_id":"screening:v1:074da20727e519d357273a7ea6d862e024a9c186bfdac5b408b7a6c57621d262","schema_version":"v1","target_dimension":"boundary","target_subclass":"B1"}