{"candidate_content_hash":"sha256:a7f7f29a68c7ec1991c1f062ce52e3fab2b622062825786ad081b917a10bf0a1","candidate_id":"candidate:v1:486b8bd7dad210611318f2291871c8dba3493d3ef2d435739776aa66e472c920","content_hash":"sha256:240cb7740b61b593441a87e55e3516caaf7e570f9cf3940f1de0a57d816c16c1","contract_type":"factory_decision","created_at":"2026-07-27T03:00:00Z","decision_id":"decision:v1:02e03f6c8b8c0e70763497ee5db24da03a796616d410ef8544bc2fa86240b073","decision_source":"automation","disposition":"accepted","findings":[{"code":"review.root_cause_required","expected":{"reviewed":true},"message":"Root-cause classification requires human review.","observed":false,"rule_id":"v07-root-cause-review","severity":"warning"}],"prior_decision":null,"rule_set_hash":"sha256:074da20727e519d357273a7ea6d862e024a9c186bfdac5b408b7a6c57621d262","rule_set_id":"screening:v1:074da20727e519d357273a7ea6d862e024a9c186bfdac5b408b7a6c57621d262","schema_version":"v1","target_dimension":"boundary","target_subclass":"B5"}